bundleid;store;app_title;description;dev_name;dev_id;fullprice;versionnumber;osreq;latest_patch;content_rating
com.sigmatech.yadav.medical;android;Infection Prevention;**The most comprehensive guideline for infection prevention on Google Play store***All data adapted with permission from the CDC Guidelines for Isolation Prevention*The main purpose of the Infection Prevention app is to decrease the level of infections and cross contamination in all medical and non medical environments.  This app is a quick and easy reference guide for every clinical and non-clinical staff at hospitals, long-term care facilities, skilled nursing facilities, ambulatory care, home care, hospice, and all staff of emergency medical services. This is a great reference tool for medical and nursing students, nurses, doctors, occupational, physical, respiratory and speech therapist.Features:•	Simple and easy to use interface.•	Sections include common hospital infections to Human pathogens•	Detailed explanation about isolation precaution types: standard, contact, droplet, and airborne•	Illustration on how to wear and take off proper protection equipment(s)•	Current CDC's guidelines for Ebola and how to wear and remove proper protection equipment.This application incorporates guidelines from the 2007 "Guidelines for Isolation Precautions: preventing transmission of infectious agents in healthcare settings"  The materials in this application are used with permission from center of disease control (CDC). Additional information was obtained from Todar's Online Textbook of Bacteriology.;Infection Prevention, LLC;Infection+Prevention,+LLC;00;2.0;4.0 and up;2015-11-04;['Everyone']
gov.cdc.general;android;CDC;NOW AVAILABLE ON YOUR SMARTPHONE OR TABLETGet the official CDC Mobile application for your tablet and/or smartphone and access the most up to date health information.FILTERING OPTIONSOrganize your home page so that the information that’s most important to you appears first! Turn off the content you don’t want with just a flip of a switch and reset it all with the tap of a button.CONTENTThe app ensures that you’re getting the most up to date health information. The home screen lets you see all your information in one place and updates whenever your device is connected to WI-FI. Enjoy a greater variety of content such as stories, videos, podcasts, and features to give you the most current health information from CDC.Browse Featured Articles, stay on top of health news in the Newsroom section, and view CDC Images of the Week. If you’re a journal reader, view the latest Morbidity & Mortality Weekly Report, Emerging and Infectious Disease journal, or the latest on Preventing Chronic Diseases. You can even search CDC’s web content from the app.We'd love to hear your thoughts about the app! Rate the CDC Mobile App in the App Store or leave a comment to let us know how we're doing. You can even send us an email through the app if you have suggestions for improvements!DISCLAIMERTHE MATERIALS EMBODIED IN THIS SOFTWARE ARE PROVIDED TO YOU "AS-IS" AND WITHOUT WARRANTY OF ANY KIND, EXPRESSED, IMPLIED OR OTHERWISE, INCLUDING WITHOUT LIMITATION, ANY WARRANTY OF FITNESS FOR A PARTICULAR PURPOSE. IN NO EVENT SHALL THE CENTERS FOR DISEASE CONTROL AND PREVENTION (CDC) OR THE UNITED STATES (U.S.) GOVERNMENT BE LIABLE TO YOU OR ANYONE ELSE FOR ANY DIRECT, SPECIAL, INCIDENTAL, INDIRECT OR CONSEQUENTIAL DAMAGES OF ANY KIND, OR ANY DAMAGES WHATSOEVER, INCLUDING WITHOUT LIMITATION, LOSS OF PROFIT, LOSS OF USE, SAVINGS OR REVENUE, OR THE CLAIMS OF THIRD PARTIES, WHETHER OR NOT CDC OR THE U.S. GOVERNMENT HAS BEEN ADVISED OF THE POSSIBILITY OF SUCH LOSS, HOWEVER CAUSED AND ON ANY THEORY OF LIABILITY, ARISING OUT OF OR IN CONNECTION WITH THE POSSESSION, USE OR PERFORMANCE OF THIS SOFTWARE.;Centers for Disease Control and Prevention;Centers+for+Disease+Control+and+Prevention;00;2.6.3;4.4 and up;2019-06-03;['Everyone']
com.smart.and.serious.university.ICNURSEltd;android;Infection Control Nurse Practice Test LTD;This app is a combination of sets, containing practice questions, study cards, terms & concepts for self learning & exam preparation on the topic of Infection Control Nurse (ICN).With this app you can learn on the Go, Anytime & Everywhere.This app is suitable for  students, researchers, resident, doctors, Anatomy & physiology specialists, nurses and medical professionals and of course Medical lecturers, teachers and professors.This app is suitable also for PANCE, MCAT, DAT, COMLEX, PACKRAT, USMLE, NCLEX, HESI, NASM, OAT, NBDE, or PCAT exam candidates.-This app is designed by educators & professors who understand the exact candidate’s needs, it’s gathered from the top educational resources.-We keep the application as simple as possible to let the learner focus only on the content-The Flashcards are exam oriented and designed to enhance quick memorization-The application is designed to let you gain time and efficiency-The Flashcards wording enhances easy understanding to ensure higher exam score.In this application you will get at least 22 study notes quiz sets.Main Features:- Works perfectly Offline- Exam oriented- 5 Study modes- Shareable content- Settings: with flexibility to change font size & background control.- Cost Effective- Rich content- Text- to- speech feature: You can use this app while you are driving, walking, and others to save your time.Invest in your Success Now. Your investment in knowledge, professionalism & expertise is durable  & with a High value added.  It's a High return investment.Disclaimer 1:This application is not dedicated for a specific professional certification, it's just a tool to assist students & professionals to expand their knowledge & in-depth their expertise.Disclaimer 2:The publisher of this android app is not affiliated with or endorsed by any testing organization. All organizational and test names are trademarks of their respective owners. The content of the application might include inaccuracies or typographical errors, for which the owner cannot be held liable.;Smart & Serious Software 3S;Smart+%26+Serious+Software+3S;00;1.0;4.0.3 and up;2018-10-22;['Everyone']
com.bodhihealthedu.infectioncontrol;android;Infection Control;Fun and engaging game to practice infection control methods for medical students, doctors, physicians or nurses based on guidelines by Centre for Disease Control and Prevention (CDC) and World Health organization (WHO)Explains the most recent and evidence-based guidelines for prevention of hospital associated infections due to various medical devices or instruments used for patient care in hospitals or health set-upsCovers wide range of medical and surgical instruments and equipments used by healthcare professionals that come in contact with patients.Clearly explains the different cleaning, sterilization and disinfection method for each equipmentInteresting graphics depicting simulated heath care set up.;Bodhi Health Education;Bodhi+Health+Education;00;1.0;2.3 and up;2016-09-03;['Everyone']
com.pkli.patientguidance;android;PKLI Infection Control;Pakistan Kidney and Liver institute and Research Center Launching his first app to Guide how to prevent from Infection control.The app Includes:1 Content about Hand Hygiene2 Complete training by using or images to teach How to prevent from Infection Control.3 Guide about Personal Protective Equipment by using images .4 Waste Management.5 Cleaning and Dis Infection.6 Safe injection.7 Immunization8 Renal Transplant;PKLI & RC;PKLI+%26+RC;00;2.0;4.0.3 and up;2018-05-02;['Everyone']
hic.tas.com.hic;android;Hospital Infection Control;HIC application  with all of the background information necessary to enhance their understanding of the rationale behind the basic principles of infection control and how to apply them in every day situations, how specific bacteria interact with the host and cause infection, the background to each of the bacteria/infections described within the text, and, evidence based recommendations on the infection control management of these.;Vijay Sahdev;Vijay+Sahdev;00;1.0;4.0.3 and up;2017-02-26;['Everyone']
com.attendify.conffr2hw0;android;PDI Infection Prevention;This is an official mobile app for PDI Infection Prevention. It will provide you with the latest updates about our events, keeping you informed and connected. Use this app to access resources, network with other attendees, and share your experience at our event.;KitApps, Inc.;KitApps,+Inc.;00;v2.8.1.2;5.0 and up;2019-09-23;['Teen']
com.freemium.mobile.app.fundamentals_nursing_infection_prevention_control.prep2019.edition;android;Fundamentals of Nursing-Infection Preven & Control;This app is a combination of sets, containing practice questions, study cards, terms & concepts for self learning & exam preparation on the topic of Fundamentals of Nursing-Infection Prevention.With this app you can learn on the Go, Anytime & Everywhere. The learning & understanding process never been so easy like with our 5 study modes embedded in this app.-The Content & design of this application is developed by Teachers & students to satisfy the exact candidates needs, it’s gathered from the top educational resources.Get our Study notes, exam quizzes, terms & definitions and Prepare & Pass Your Exam easily to guarantee the highest score.Our Learners get the best, that's why they don't just meet standards, They exceed them.By the end of this app we expect that you expand your knowledge, widen your expertise, improve your practical skills and Broaden your academic & career  horizons.We promise that this app will strengthen your self-confidence during the exam & daily work.Remember that you should get the Skills you need to land the job you want.Learn & educate your self as much as you can, knowledge is the real and best capital  & asset that you own.Invest in your Success Now. Your investment in knowledge, professionalism & expertise is durable  & with a high value added.  It's the highest return investment.-We keep the application as simple as possible to let the learner focus only on the content-The Flashcards are exam oriented and designed to enhance quick memorization-The application is designed to let you gain time and efficiency-The Flashcards wording enhances easy understanding to ensure higher exam score.In this application you will get over 20 Exam sets.This App  energized your creativity, showcases your talents and strength your self-confidence during the exam & daily work.You will get better understanding, less preparation time & a better score in the exam.-This application is downloaded and used by graduate & undergraduate students, teachers, lecturers, professionals, PhD, researchers, reviewers not only in the US but also in Philippines, Canada, India, Australia, Turkey, Russia, UK, GCC, India, Saudi Arabia, Nigeria, and all over the world.Main Features:- exam questions and study notes- 5 study modes- Shareable content- Settings: with flexibility to change font size & background control.This application allows you to expand your knowledge, widen your expertise, improve your practice skills, Broaden your academic & career horizons.;Premium mobile apps;6967685105373378095;00;1.2;4.1 and up;2019-01-09;['Everyone']
gov.cdc.ondieh.nccdphp.cdcdentalcheck;android;CDC DentalCheck;Centers for Disease Control and Prevention’s (CDC) evidence-based recommendations guide infection control practices in dental offices nationally and globally, provide direction for the public, dental health care personnel (DHCP) and policymakers, and affect technology development in the dental industry.CDC DentalCheck is developed directly from the Infection Prevention Checklist for Dental Settings. DHCP can use this app to periodically assess practices in their facility and ensure they are meeting the minimum expectations for safe care. The infection prevention coordinator and other staff trained in infection prevention are encouraged to use this app at least annually to assess the status of their administrative policies and practices, and engage in direct observation of personnel and patient-care practices.While the information included in this app reflects existing evidence-based guidelines produced by the CDC, it is not intended as a replacement for more extensive guidelines.Key Features•	Check Yes/No to acknowledge compliance with a list of administrative policies or observed practices•	Summary of basic infection prevention principles and recommendations for dental health care settings•	Ability to export results for records managementProvides links to full guidelines and source documents that users can reference for more detailed background and recommendations.;Centers for Disease Control and Prevention;Centers+for+Disease+Control+and+Prevention;00;1.0.2;5.0 and up;2017-12-19;['Everyone']
com.premium.mobile.app.nursing_infection.prep2019.edition;android;Fundamentals of Nursing-Infection Prevention;This app is a combination of sets, containing practice questions, study cards, terms & concepts for self learning & exam preparation on the topic of Fundamentals of Nursing-Infection Prevention.With this app you can learn on the Go, Anytime & Everywhere. The learning & understanding process never been so easy like with our 5 study modes embedded in this app.-The Content & design of this application is developed by Teachers & students to satisfy the exact candidates needs, it’s gathered from the top educational resources.Get our Study notes, exam quizzes, terms & definitions and Prepare & Pass Your Exam easily to guarantee the highest score.Our Learners get the best, that's why they don't just meet standards, They exceed them.By the end of this app we expect that you expand your knowledge, widen your expertise, improve your practical skills and Broaden your academic & career  horizons.We promise that this app will strengthen your self-confidence during the exam & daily work.Remember that you should get the Skills you need to land the job you want.Learn & educate your self as much as you can, knowledge is the real and best capital  & asset that you own.Invest in your Success Now. Your investment in knowledge, professionalism & expertise is durable  & with a high value added.  It's the highest return investment.-We keep the application as simple as possible to let the learner focus only on the content-The Flashcards are exam oriented and designed to enhance quick memorization-The application is designed to let you gain time and efficiency-The Flashcards wording enhances easy understanding to ensure higher exam score.In this application you will get over 20 Exam sets.This App  energized your creativity, showcases your talents and strength your self-confidence during the exam & daily work.You will get better understanding, less preparation time & a better score in the exam.-This application is downloaded and used by graduate & undergraduate students, teachers, lecturers, professionals, PhD, researchers, reviewers not only in the US but also in Philippines, Canada, India, Australia, Turkey, Russia, UK, GCC, India, Saudi Arabia, Nigeria, and all over the world.Main Features:- exam questions and study notes- 5 study modes- Shareable content- Settings: with flexibility to change font size & background control.This application allows you to expand your knowledge, widen your expertise, improve your practice skills, Broaden your academic & career horizons.;Premium mobile apps;6967685105373378095;299;1.4;4.1 and up;2019-01-08;['Everyone']
com.stormid.preventinginfection;android;Preventing Infection At Home;Preventing Infection in Care at Home (PIIC@H)This resource provides a comprehensive toolkit for the application of the Standard Infection Control Precautions (SICP) for all community Health and Social Care staff.It lists common infection risks you may encounter when visiting someone in their own home to provide care. Choose one and it reveals the “must do” SICP guidance to follow that can minimise the risk of spreading infection to you and the person you care for. It also offers key advice on areas to consider and other factors to keep you, and those you care for, safe from the spread of infection.If you just want an update on the Standard Infection Control Precautions, and how they relate to the care you provide in someone’s home, then go directly to the list of SICP for more information.This is an invaluable resource for all and any community staff who visits homes to care for someone.Developed by NHS Education for Scotland, in collaboration with Health Protection Scotland, Care Inspectorate and Scottish Care.;NHS Education for Scotland;NHS+Education+for+Scotland;00;1.1;2.2 and up;2016-04-18;['Everyone']
com.StatPearls.RNC_INFECTION_CONTROL_CIC;android;Nurse Infection Control (CIC);Free questions to try before you buy!Nurse Infection Control (CIC) Multiple Choice Question Review Includes:- Multiple choice fact, scenario and case-based questions- Correct answers and explanations to help you quickly master content- Take practice questions as many times as you wish- Score and transcripts with missed key words to help you evaluate areas that need further studyThe mission of StatPearls is to help you identify and correct knowledge deficits.  We do this by providing high quality, peer-reviewed, educationally sound questions with explanations written by leading educators.StatPearls Publishing, LLC;StatPearls Publishing, LLC;5768971529442162036;00;1.1.7;4.0 and up;2016-05-17;['Everyone']
com.medhand.WRICN;android;Rapid Infection Control Nurs.;This FREE sample of Rapid Infection Control Nursing provides examples of the material to give an inside view of the full content available.  The full version is available for PURCHASE within the app.This Wiley - Blackwell app-book is developed by MedHand Mobile Libraries. Improve your performance with relevant, valid material which is accessed quickly and with minimal effort in the palm of your hand using MedHand’s patented technology.THIS APP-BOOK for Rapid Infection Control Nursingincludes unique functions such as:•	A powerful search•	Bookmarks•	Complete set of medical calculators, Body Mass Index, Peak Expiratory Flows, Dehydration Correction Calculator and more•	Highlighting•	High resolution pictures•	History•	Notes and picture notesThe Rapids are a series of reference and revision pocket books that cover key facts in a simple and memorable way. Each book contains the common conditions that students and newly qualified nurses encounter on the wards, in the community, and on placements. Only the basic core relevant facts are provided to ensure that these books are perfect and concise rapid refreshers.Rapid Infection Control Nursing is an essential read for all frontline nursing staff working in hospitals or community settings. Designed for quick reference, it explores the essential principles of infection control before moving on to an A-Z of the most commonly found infections. Each entry covers how the infection is spread, duration of the infectious period, key infection-control precautions, staff considerations, visitor information, and patient transfer advice.Covering all the key topics in infection prevention and control, this concise and easy-to-read title is the perfect quick-reference book for the wards.Authors: Shona Ross, Sarah FurrowsPublisher: Wiley – Blackwell________________________________________MedHand Mobile Libraries offers a SUBSCRIPTION FREE application without edition upgrade. The apps enables you to make notes, picture notes, search, medical calculators, add bookmarks and review what you previously been reading.MedHand delivers what you need, trusted knowledge at the point of care! Offering most trusted and well recognized medical guidelines provided by excellent publishers like Oxford University Press, McGraw-Hill, PDR Network LLC, Wiley and more.;Indextra AB;Indextra+AB;00;2.3.2;3.0 and up;2015-04-14;['Everyone']
com.andromo.dev686997.app800060;android;All Vaginal Infections & Treatments;It's very very important for all children (girls), women and sometimes men to know everything about vaginal infections and their solutions. Children should be educated at early ages about their  meaning, causes, symptoms, prevention and treatments to help them prevent future problems and prevent living their future life in agony.This  application Contain full details (overview, Causes , risk factors, sign,symptoms, Complications, home remedies, treatments and prevention of each infection and other problems.Some of the infections &  problems included are as follows:1. INFECTIONS:- Bacterial Vaginosis- Trachomonas Infection- Vaginal Yeast Infections- Vaginal Warts2. MISCELLANEOUS ISSUES- Vaginal Bleeding- Vaginal Discharge- Vaginal Dryness- Vaginal Odor- Vaginal Pain- Vaginal CancerThis application  provides all the necessary information you may  need to know about your  vaginal infections & their solutions The text are short,precise, and in simple language to help everyone understand.This app will surely, help you to know all you need and live a happy life.REMEMBER:You can live a healthy and happier life like everyone. You just need to know how to and this application  will help you, surely.Don't forget to share your suggestion,views, requests and advises via our email. Also DON'T FORGET to rate our application. Both will help us improving the applications timely.Thank you & Stay happy & Healthy ! !! !!!.;Free _ apps;Free+_+apps;00;5.0;4.1 and up;2019-08-29;['Everyone']
com.infection.control;android;Infection Control;Who really knows whats going on inside your body? Maybe these guys do! Play as a Helper T cell or Infected Germ as you travel your way around consuming opposing forces without mercy. Play the solo campaign and master your skills and then move onto the big leagues and invite friends and family with the share button to join in on the battle! Each character is equipped with special abilities which will provide you with a unique strategy to consume one another. But the real question is will you be the ONE to control the infection?;Slkool Games;Slkool+Games;00;1;4.1 and up;2019-03-26;['Everyone']
gov.cdc.stdtxguide;android;STD Tx Guide;The STD Tx Guide app is a quick reference guide for healthcare professionals and related parties on the identification of and treatment for sexually transmitted diseases.With the STD Tx Guide app you get:•	Fast access to recommended treatment regimens•	List of common Terms and Abbreviations•	Includes CDC’s guide to Taking a Sexual History•	Push notifications for guideline updatesThe app is a collaboration between CDC's Division of STD Prevention and the Informatics Innovation Unit (IIU) within CDC's Division of Public Health Information Dissemination (DPHID) - Center for Surveillance, Epidemiology and Laboratory Services (CSELS).These guidelines for the treatment of persons who have or are at risk for sexually transmitted diseases (STDs) were updated by CDC after consultation with a group of professionals knowledgeable in the field of STDs who met in Atlanta on April 30–May 2, 2013. The information in this report updates the Sexually Transmitted Diseases Treatment Guidelines, 2010 (MMWR Recomm Rep 2010,59 [No. RR–12]). These updated guidelines discuss 1) alternative treatment regimens for Neisseria gonorrhoeae, 2) the use of nucleic acid amplification tests for the diagnosis of trichomoniasis, 3) alternative treatment options for genital warts, 4) the role of Mycoplasma genitalium in urethritis/cervicitis and treatment-related implications, 5) updated HPV vaccine recommendations and counseling messages, 6) the management of persons who are transgender, 7) annual testing for hepatitis C in persons with HIV infection, 8) updated recommendations for diagnostic evaluation of urethritis, and 9) retesting to detect repeat infection. Physicians and other health-care providers can use these guidelines to assist in the prevention and treatment of STDs.;Centers for Disease Control and Prevention;Centers+for+Disease+Control+and+Prevention;00;1.2.1.2;4.4 and up;2019-06-03;['Everyone']
