bundleid;store;app_title;description;dev_name;dev_id;fullprice;versionnumber;osreq;latest_patch;content_rating
com.americares;android;I-SPEAR;Americares India Foundation a non-profit organization with support of LTMMC & G Hospital has developed mobile application to train healthcare workers (like Doctors, Nurses etc) on Infection Prevention & Control (IPC).  The android based app will give access to training material consisting of slides with invoice, graphics, guidelines & protocols and pictorials.The mobile application is uniquely designed & featured in small steps, locked chapters & test to make learning innovative, simple, step by step, easy to access, interesting and motivating to ensure, the participants complete their course.This course will provide an opportunity to review in more depth the use of standard infection prevention and control measures. The participant will also learn how you should apply principles of infection control knowledge in practice.Course Content:•	Basic of infection Prevention Control•	Standard Precautions•	Hand Hygiene•	Personal Protective Equipment•	Blood Borne Pathogens•	Safe Injection Practices•	Safe Handling of Needles and Sharps•	Biomedical waste management•	Cleaning, Disinfectants and Sterilization•	Airborne Infection ControlComplete Course Duration: Appx 2 hour divided in 10 chapters of 10-15mins each.Who is this course for?This course is aimed to train clinical healthcare staff and healthcare assistants on Infection Prevention & Control (IPC).Steps of Training Course.•	Assess your IPC Knowledge through a Test on the App.•	Learn IPC through Training Slides•	Watch Training videos to enhance your knowledge and skills.•	Evaluate your knowledge on each section through a test•	Successfully complete 10 tests with >50% to be eligible for the final test•	Appear and pass the Final Test with >50%•	You are now a certified IPC Healthcare Worker.Americares India Foundation is thankful to BMSF for generous financial grant and Department of Microbiology, L.T.M.M. college & General Hospital for technical support to develop this mobile application.;Americaresindia;Americaresindia;00;2.0;5.0 and up;2019-06-29;['Everyone 10+']
com.smart.and.serious.university.ICNURSE;android;Infection Control Nurse Practice Test 3300 Quizzes;This app is a combination of sets, containing practice questions, study cards, terms & concepts for self learning & exam preparation on the topic of Infection Control Nurse (ICN).With this app you can learn on the Go, Anytime & Everywhere.This app is suitable for  students, researchers, resident, doctors, Anatomy & physiology specialists, nurses and medical professionals and of course Medical lecturers, teachers and professors.This app is suitable also for PANCE, MCAT, DAT, COMLEX, PACKRAT, USMLE, NCLEX, HESI, NASM, OAT, NBDE, or PCAT exam candidates.-This app is designed by educators & professors who understand the exact candidate’s needs, it’s gathered from the top educational resources.-We keep the application as simple as possible to let the learner focus only on the content-The Flashcards are exam oriented and designed to enhance quick memorization-The application is designed to let you gain time and efficiency-The Flashcards wording enhances easy understanding to ensure higher exam score.In this application you will get at least 22 study notes quiz sets.Main Features:- Works perfectly Offline- Exam oriented- 5 Study modes- Shareable content- Settings: with flexibility to change font size & background control.- Cost Effective- Rich content- Text- to- speech feature: You can use this app while you are driving, walking, and others to save your time.Invest in your Success Now. Your investment in knowledge, professionalism & expertise is durable  & with a High value added.  It's a High return investment.Disclaimer 1:This application is not dedicated for a specific professional certification, it's just a tool to assist students & professionals to expand their knowledge & in-depth their expertise.Disclaimer 2:The publisher of this android app is not affiliated with or endorsed by any testing organization. All organizational and test names are trademarks of their respective owners. The content of the application might include inaccuracies or typographical errors, for which the owner cannot be held liable.;Smart & Serious Software 3S;Smart+%26+Serious+Software+3S;199;1.0;4.0.3 and up;2018-10-22;['Everyone']
com.elsevier.stmj.jat.newsstand.yjhin;android;Journal of Hospital Infection;The Journal of Hospital InfectionThe Official Journal of the Healthcare Infection SocietyIt just got a whole lot easier to keep up with the latest scientific research and articles on all aspects of hospital infection. The Journal of Hospital Infection app brings you the convenience of reading your favorite journal from anywhere in the world with just a tap. Now available for android smartphones and tablets!• Stay ahead with alerts when new issues are available and read Articles in Press throughout the month• Experience innovative digital content with the newly introduced Article enhancements, featuring AudioSlides, Virtual Microscope, 3D Radiological Viewer, 3D Neuroimaging Viewer, and more.• Get access to the journal content on the app via your institution’s IP• Enjoy Open Access and Open Archive Content without having to login• Accessibility support to assist the visually impaired• Interact with figures, tables, and supplementary content• Stream multimedia for faster viewing or download for later• Take notes, highlight articles and share via email and social media• Personalize your experience with My Reading List and save articles for offline readingJournal Subscribers: Log in with the same username and password that grants you access to the full journal content on the Journal of Hospital Infection website. These credentials will allow full access to all content on the app.About The Journal of Hospital InfectionThe Journal of Hospital Infection is the editorially independent scientific publication of the Healthcare Infection Society. The aim of the Journal is to publish high quality research and information relating to infection prevention and control that is relevant to an international audience.The Journal welcomes submissions that relate to all aspects of infection prevention and control in healthcare settings. This includes submissions that:• provide new insight into the epidemiology, surveillance, or prevention and control of healthcare-associated infections and antimicrobial resistance in healthcare settings,• provide new insight into cleaning, disinfection and decontamination• provide new insight into the design of healthcare premises.• describe novel aspects of outbreaks of infection,• throw light on techniques for effective antimicrobial stewardship,• describe novel techniques (laboratory-based or point of care) for the detection of infection or antimicrobial resistance in the healthcare setting, particularly if these can be used to facilitate infection prevention and control,• improve understanding of the motivations of safe healthcare behaviour, or describe techniques for achieving behavioural and cultural change,• improve understanding of the use of IT systems in infection surveillance and prevention and control.Our privacy policy is here: http://www.elsevier.com/EULA_non-Apple_apps;Elsevier Inc;Elsevier+Inc;00;7.5.1;4.4 and up;2019-07-16;['Everyone']
com.stdi;android;Sexually Transmitted Disease and Infections;This app provides necessary information about Sexually Transmitted Disease and Infections (STD) and it is available in more than 25+ different languages.It will be the best for people who are eager to learn about sexually transmitted infections and Diseases .It has complete information about Disease, prevention, complications and so on. Each Disease in the app is being described with following details:•	Introduction of diseases•	Most common Sign and Symptoms of diseases•	How to Diagnosis and Tests of diseases•	Basic Treatment of diseases•	Major Complications being caused by diseases•	Prevention to taken for diseasesKey features of the app:•	Having information for more than 20+ Disease•	Available in 25+ languages (Read in your own local language)•	User friendly•	Light weight•	No login or signup required•	Easy to useApp provides information about following Diseases in 25+ different languages:•	Bacterial vaginosis•	Chlamydia•	Gonorrhoea•	Trichomoniasis•	Chancroid•	Lymphogranuloma venereum (LGV)•	Scabies•	Syphilis•	HIV AIDS•	Genital herpes•	Human papillomavirus (hpv) infection and genital warts•	Hepatitis b•	Hepatitis c•	Pubic lice(crabs)•	Candidiasis (yeast infection)•	Molluscum contagiosum•	Herpes simplex virus•	Enfermedad inflamatoria pelvicaInformation inside app is available in Arabic, Bengali, Chinese, Dutch, English, French, German, Gujarati, Hindi, Italian, Japanese, Kannada, Malayalam, Marathi, Persian, Portuguese, Punjabi, Russian, Sindhi, Spanish, Tamil, Telugu and Urdu.Information has been collected from various sources provide you people the very correct and useful information.Please provide your feedback about app to keep it improving.;Sonal Hadiya;Sonal+Hadiya;00;1.1;4.4 and up;2019-04-01;['Mature 17+', 'Sexual Themes']
com.topoflearning.free.medical.vibering.infectious.diseases.application;android;Infectious Disease Full Review;If you intend to become an expert in Infectious Diseases, this app is what you need, It starts fro the introduction to go deeper in the field. It's highly recommended for USMLE Step 2 CK and equivalent exams.This is the only specialized Infectious diseases app that covers all the Infectious diseases science spectrum from the introduction to the expertise.Get +2830 Infectious diseases notes & questions with answers & prepare your exam easily within less time. you could become an expert in Infectious diseases if you master all the topics covered by this  professional app.During this promotion you will get 4 apps for the price of one:-Infectious diseases notes & questions- Medical abbreviations-Medical terminology  sorted by topic-Medical Law & EthicsUS Doctors, who prepare USMLE exam use this app, here's why:-Tailored study notes to suit your preparation and exam needs-Less time for preparation-Exam focused questions and answers-Developed to let you succeed from the first attempt-Affordable price to all student , researchers, professionals, and doctors.This app is intended to  students, researchers, resident, doctors, Anatomy & physiology specialists, nurses and medical professionals and of course Medical lecturers, teachers and professors.Get a better score in your  USMLE  (step1, step2  CS & CK), PANCE, MCAT, DAT, COMLEX, OAT, NBDE,  or PCAT exam, and the most important  is to fall in love with the material, it worth all the attention.Infectious disease is a medical specialty dealing with the control and treatment of infections. An infectious disease (ID) specialist's practice may consist largely of managing nosocomial (hospital-acquired) infections, or it may be out-patient based, in which case it focuses more on community-acquired infections. ID is historically associated with travel medicine and tropical medicine, as many diseases acquired in tropical and subtropical areas are infective in nature. ID specialists typically serve as consultants in cases of complex infections or immunologic issues, and often manage patients with HIV/AIDS and other forms of immunodeficiency.In the US, ID is a subspecialty of internal medicine or pediatrics (i.e., an internist or pediatrician trains for an additional 1-2 years as a medical fellow to qualify as an ID specialist and sit for the ID boards).There are four main kinds of germs:Bacteria - one-celled germs that multiply quickly and may release chemicals which can make you sickViruses - capsules that contain genetic material, and use your own cells to multiplyFungi - primitive plants, like mushrooms or mildewProtozoa - one-celled animals that use other living things for food and a place to liveNIH: National Institute of Allergy and Infectious DiseasesThis educational & medical application is intended to r:NCLEX-RNNCLEX-PNNCLEXCNA,ANP - Adult Nurse PractitionerFNP - Family Nurse PractitionerA-GNP - Adult-Gero Primary Nurse PractitionerANP-BC Adult Nurse PractitionerFNP-BC Family Nurse PractitionerPNP-BC Pediatric Nurse PractitionerACNP-BC Acute Care Nurse PractitionerGNP - BC Gerontological Nurse PractitionerPMHNP-BC Adult Psychiatric and Mental Health Nurse PractitionerPMHNP-BC Family Psychiatric and Mental Health Nurse PractitionerCNRN®SCRN®and also for USMLE, COMLEX, ANCC Certification Center.This app is also suitable for  students, researchers, resident, doctors, Anatomy & physiology specialists, nurses and medical professionals and of course Medical lecturers, teachers and professors.Get a better score in your  USMLE  (step1, step2  CS & CK), PANCE, MCAT, DAT, COMLEX,CNA, OAT, NBDE,  or PCAT exam, and the most important  is to fall in love with the material, it worth all the attention.;Top of Learning;5921705092973127988;00;1.0;2.0 and up;2015-04-26;['Everyone']
com.maithu.ebola;android;Ebola Guidelines;This app was created by Medical eGuides using content from the World Health Organisation (WHO) and the United States Centers for Disease Control and Prevention (CDC).  It is provided Free of Charge 'as is' to provide Healthcare Personnel with guidelines on Ebola in an easy to use format, at the point of care.Medical eGuides is a multi-award winning company based in Dublin, Ireland providing eHealth solutions to the Healthcare industry.  Our solutions improve Patient Outcomes by giving Healthcare workers the correct information at the point of care and in an accessible format.  Personnel always have the correct and most recent guidelines, as updates are pushed automatically to the app.If you would like to discuss any requirements for delivery of app based clinical guidelines, please contact:info@medicaleguides.comSource content:Interim Infection Prevention and Control Guidance for Care of Patients with Suspected or Confirmed Filovirus Haemorrhagic Fever in Health-Care Settings, with Focus on Ebola.World Health OrganisationSeptember 2014.Ref: WHO/HIS/SDS/2014.4http://apps.who.int/iris/bitstream/10665/130596/1/WHO_HIS_SDS_2014.4_eng.pdf?ua=1&ua=1&ua=1Ebola virus key factsWHO http://www.who.int/mediacentre/factsheets/fs103/en/Ebola contact tracingUnited States Centers for Disease Control and Prevention (CDC)http://www.cdc.gov/vhf/ebola/pdf/contact-tracing.pdfSpecimen Collection, Transport, Testing, and Submission for Patients with Suspected Infection with Ebola Virus Disease, CDChttp://www.cdc.gov/vhf/ebola/pdf/ebola-lab-guidance.pdf;MEG Support Tools;MEG+Support+Tools;00;1.0;3.0 and up;2014-10-11;['Everyone']
measles.virus.infection.treatment.prevention.info;android;Measles Virus Infection Treatment & Prevention;Measles Virus Infection Treatment & Prevention android mobile app provides full step by step detail explanation on how to treat and prevent measles virus infection disease from occurring.The measles virus is highly contagious and can cause blindness, deafness, brain damage or death. It is currently spreading in outbreaks in many parts of the world. Some have recorded cases of the extremely contagious and sometimes deadly disease.Measles is a viral disease that can spread rapidly. Also known as rubeola or morbilli, measles is an endemic disease, meaning it is continually present in a community, and many people develop resistance.It is an unpleasant condition but one that normally passes without treatment within 7 to 10 days.Info App Contain:- Measles origin.- Measles virus infection sign and symptoms.- Measles disease infection risk factor and cause.- Important prevention step on dealing with this contagious virus from re-occur.- Necessary treatment step to eliminate this infectious virus.App Features:- Easy app navigation and graphic user interface (GUI).- Zoom-in and Zoom-Out function for easy readable contain.- include with inforgraphic to further understatement.- Systematic information structure for easy understandable info.- Work in offline modeDownload Measles Virus Infection Treatment & Prevention health medical info app now in google play to equip with this contagious yet deadly disease now. Prevention step is always better then cure!;Best Top Daily Guide & Info;Best+Top+Daily+Guide+%26+Info;00;1.0.2;4.0.3 and up;2019-08-01;['Everyone']
se.esolutions.ataxx.infection;android;Infection - Board Game;Infection is an abstract strategy board game that involves play by two parties on a seven-by-seven square grid. The object of the game is to make your pieces constitute a majority of the pieces on the board at the end of the game, by converting as many of your opponent's pieces as possible.Based on an early 90's arcade game.Infection is also known by such names as Ataxx, Boogers, Slime Wars and Frog Cloning.;eSolutions Nordic AB;4825767348403401016;00;1.3.4;4.1 and up;2019-06-03;['Everyone']
com.MacawDev.Outbreak;android;Outbreak - Infect The World;Play a strategic simulation of an infectious disease spreading around the world - begin your own global pandemic.Choose a country you want to start your infection in and begin your pandemic. Gain evolution points and upgrade your disease's symptoms, transmission routes and resistance to external factors.Develop your own strategy to win the game - the possibilities are unlimited. The disease can spread to neighboring countries across the borders, on a plane or on a ship, and even migrating birds can contribute.Occasionally natural disasters happen - choose the country you want the disaster to start in, and automatically help your disease to spread abroad.You can play with one of following pathogens, each unlocked one after another: Bacteria, Virus, Protozoa, Parasite, Fungus, Prion, Extraterrestrial, Zombie or create your own custom pathogenic organism.Watch out, as humanity will try to do whatever they can to stop your disease from spreading. After they classify the disease as an epidemic danger, they will start developing a vaccine that can provide immunity to the disease and thus save them.There are 2 gamemodes! You can also play as Humanity, where a pathogen is the enemy, and take your chances in saving people from extinction. You will be able to close borders, airports and seaports, as well as upgrade disease prevention methods or even use United Nations missions. The goal is to develop a vaccine and save as many as possible.;MacawDev;MacawDev;00;1.4.0;5.0 and up;2019-04-30;['Everyone']
cemjc.codeit.infectionsthegame;android;Infection;INFECTION is an gaming app designed to fuse sexual health information and entertainment in a creative and enriching manner. Engage with the game's characters and take a trip through the scenic Belizean inspired levels avoiding viruses, needles and walls. Gain knowledge & skills to propel you through each level.As one of the flagship programs for the National AIDS Commission (Belize), "Infection" is a vision of concept design and fun user-friendly gaming that is sure to engaging the gamer for hours. "Infection" boasts an incredibly realistic laid-back Caribbean vibe but delivers all the quick game play and action that gamers want.With a smooth and seamless game play, "Infection" is a game that begs to played, offering the player a glimpse into some of Belize's choice destinations and culturally iconic settings...the gamer gets a feel for the Belizean atmosphere and culture."Infection" imparts much need sexual and reproductive health information as well as locations that provide health care in Belize. Take note of the information and at the end of each level you are required to answer a few questions correctly in order to advance to the next level. "Infection" is an educational tool as well as a fun game.;National AIDS Commission Secretariat;National+AIDS+Commission+Secretariat;00;1.1;3.2 and up;2016-03-01;['Everyone']
com.liixuos.apps.antibioticcmninfect;android;Antibiotics for common infections;Antibiotics for common infections is a free app designed to meet the needs of medical students, nursing, general practitioners, physicians, junior doctors and other health professionals regarding anti-bacterial agents and their use in bacterial infections.The app is free and working offline with beautiful material design interface and the diseases given in this app are bacterial infections of various human systems commonly encountered in adults and children and information is provided about their:-Management guidelines-Common pathogens-The first line antibiotics-Alternatives-with their dosages and durationsNOTE: The information in this antibiotics application is intended to provide general medical information, it is not a substitute for the expertise and judgment of your healthcare providers. You should consult your health care professional before taking any drugs.Our application has endeavored to ensure the accuracy of the data, but still no guarantee can be given that the content is 100% error free.Suggestions and comments regarding errors or for further improvement would be appreciated.;Liixuos;8436014751306265947;00;2.0.0;4.0 and up;2018-10-29;['Everyone 10+']
com.canvassoft.Infection;android;Infection.;You are Zombie! Eat up all humanity!!A totally new zombie crowd action puzzle game appeared! Unforgettable feeling of attacking crowds who are frightened by zombies and run away! What?Let's hunt down hundreds of crowds and destroy them at once!And various gimmicks are prepared for each stage! How competitive we are going Player's competence will be tried now!▼ How to play- "You" has unfortunately become a zombie.- "You" who became a zombie has only the feeling of wanting to kill and kill the crowd.- You can kill himself to zombies by approaching the crowd in the state of a zombie.- The zombieized crowd walks behind himself.- Of course the fellow zombies will also eat and kill the crowd.- Since the crowd escapes according to certain rules, let's use that trait well, go ahead and pursue the crowd and turn it into zombies.- It will be clear if we were able to make the number of people determined for each stage zombies.;CanvasSoft;5857483678333630761;00;1.6.6;4.4 and up;2019-10-05;['Teen', 'Violence, Blood, Language']
com.nupuit.qcbic;android;CBIC Exam Quiz;CBIC  Exam QuizKey Features of this APP:•	At practice mode you can see the explanation describing the correct answer.•	Real exam style full mock exam with timed interface•	Ability to create own quick mock by choosing the number of MCQ’s.•	You can create your profile and see your result history with just one click.•	This app contains large number of question set that covers all syllabus area.The Certification Board of Infection Control & Epidemiology, Inc. (CBIC®) is a voluntary, autonomous, multidisciplinary board that provides direction for and administers the certification process for professionals in infection control and applied epidemiology. CBIC is independent and separate from any other infection control-related organization or association, but does collaborate with three partner organizations (APIC, IPAC, and IFIC) to help promote the importance of being certified in infection prevention and control;NUPUIT;8850556472980561385;00;1.0.2;4.1 and up;2018-06-26;['Everyone']
com.nupuit.cbic;android;CBIC Test Prep;CBIC MCQ Exam Prep•	At practice mode you can see the explanation describing the correct answer.•	Real exam style full mock exam with timed interface•	Ability to create own quick mock by choosing the number of MCQ’s.•	You can create your profile and see your result history with just one click.•	This app contains large number of question set that covers all syllabus area.The Certification Board of Infection Control & Epidemiology, Inc. (CBIC®) is a voluntary, autonomous, multidisciplinary board that provides direction for and administers the certification process for professionals in infection control and applied epidemiology. CBIC is independent and separate from any other infection control-related organization or association, but does collaborate with three partner organizations (APIC, IPAC, and IFIC) to help promote the importance of being certified in infection prevention and control;xoftit;5192948484400722837;00;3.0.4;4.1 and up;2019-04-18;['Everyone']
com.nupuit.cbffc;android;CBIC Flashcard;CBIC FlashcardThe Certification Board of Infection Control & Epidemiology, Inc. (CBIC®) is a voluntary, autonomous, multidisciplinary board that provides direction for and administers the certification process for professionals in infection control and applied epidemiology. CBIC is independent and separate from any other infection control-related organization or association, but does collaborate with three partner organizations (APIC, IPAC, and IFIC) to help promote the importance of being certified in infection prevention and control;NUPUIT;8850556472980561385;00;1.0;4.0.3 and up;2018-05-20;['Everyone']
